{
  "generated_at_utc": "2026-03-07T00:00:00Z",
  "source_repo": "rather-not-work-on/platform-contracts",
  "bundle_version": "2026.03.07",
  "schema_count": 2,
  "schemas": [
    {
      "schema_name": "c4-provider-invocation.schema.json",
      "contract_id": "c4-provider-invocation",
      "path": "schemas/c4-provider-invocation.schema.json",
      "sha256": "aaaaaaaaaaaaaaaaaaaaaaaaaaaaaaaaaaaaaaaaaaaaaaaaaaaaaaaaaaaaaaaa"
    },
    {
      "schema_name": "c5-observability-event.schema.json",
      "contract_id": "c5-observability-event",
      "path": "schemas/c5-observability-event.schema.json",
      "sha256": "bbbbbbbbbbbbbbbbbbbbbbbbbbbbbbbbbbbbbbbbbbbbbbbbbbbbbbbbbbbbbbbb"
    }
  ]
}
